{
  "acceptance_id": "v2.31_Public_BOIS_Common_Core_Operator_Acceptance_Template",
  "acceptance_status": "NOT_ESTABLISHED_BY_PACKAGE_LOAD",
  "accepted_at": null,
  "accepted_layers": [
    "BASE"
  ],
  "accepted_norm_ids": [],
  "artifact_version": "2.31",
  "authority_source": null,
  "canon_active_norm_count": 364,
  "external_action_authority": "NOT_GRANTED",
  "loading_is_acceptance": false,
  "operator_acceptance_status": "NOT_INSTALLED_IN_PUBLIC_PACKAGE",
  "personal_norm_ids": [
    "P-N-001",
    "P-N-002",
    "P-N-003",
    "P-N-004",
    "P-N-005",
    "P-N-006",
    "P-N-007",
    "P-N-008",
    "P-N-009",
    "P-N-010",
    "P-N-011",
    "P-N-012",
    "P-N-013",
    "P-N-014",
    "P-N-015",
    "P-N-016",
    "P-N-017",
    "P-N-018",
    "P-N-019",
    "P-N-020",
    "P-N-021",
    "P-N-022",
    "P-N-023",
    "P-N-024",
    "P-N-025",
    "P-N-026",
    "P-N-027",
    "P-N-028",
    "P-N-029",
    "P-N-030",
    "P-N-031",
    "P-N-032",
    "P-N-033",
    "P-N-034",
    "P-N-035",
    "P-N-036",
    "P-N-037",
    "P-N-038",
    "P-N-039",
    "P-N-040"
  ],
  "record_type": "OPERATOR_ACCEPTANCE_TEMPLATE",
  "rejected_norm_ids": [],
  "release_id": "v2.31_Public_BOIS_Common_Core",
  "required_runtime_fields": [
    "operator_id_or_role",
    "accepted_norm_ids",
    "rejected_norm_ids",
    "scope",
    "accepted_at",
    "authority_source",
    "valid_until",
    "revocation_route",
    "external_action_authority"
  ],
  "revocation_route": "INSTALL_NEW_SIGNED_ACCEPTANCE_RECORD",
  "runtime_authorization_status": "NOT_GRANTED_BY_CANON",
  "scope": [],
  "validity": "NOT_ESTABLISHED"
}
